{
  "$schema": "https://json-schema.org/draft/2020-12/schema",
  "$id": "https://raw.githubusercontent.com/nccrypto/agentic-commerce-toolkit/main/schemas/source-manifest-v1.schema.json",
  "title": "Agentic Commerce Source Manifest v1",
  "description": "A portable manifest describing public sources used by an agentic-commerce job or dataset.",
  "type": "object",
  "additionalProperties": false,
  "required": [
    "schemaVersion",
    "manifestId",
    "generatedAt",
    "subject",
    "sources"
  ],
  "properties": {
    "schemaVersion": {"const": "1.0"},
    "manifestId": {
      "type": "string",
      "pattern": "^[a-z0-9][a-z0-9._:-]{2,127}$",
      "description": "Stable, non-secret identifier for this manifest."
    },
    "generatedAt": {"type": "string", "format": "date-time"},
    "subject": {
      "type": "object",
      "additionalProperties": false,
      "required": ["kind", "name"],
      "properties": {
        "kind": {
          "type": "string",
          "pattern": "^[a-z][a-z0-9._-]{1,63}$",
          "description": "Public category for the thing being documented, such as protocol, dataset, inspector-output, or agent-job."
        },
        "name": {
          "type": "string",
          "minLength": 1,
          "maxLength": 160
        },
        "version": {
          "type": "string",
          "minLength": 1,
          "maxLength": 80
        },
        "description": {
          "type": "string",
          "minLength": 1,
          "maxLength": 500
        }
      }
    },
    "sources": {
      "type": "array",
      "minItems": 1,
      "maxItems": 100,
      "items": {"$ref": "#/$defs/source"}
    },
    "notes": {
      "type": "array",
      "maxItems": 20,
      "items": {
        "type": "string",
        "minLength": 1,
        "maxLength": 500
      }
    }
  },
  "$defs": {
    "source": {
      "type": "object",
      "additionalProperties": false,
      "required": [
        "sourceId",
        "title",
        "url",
        "sourceType",
        "publisher",
        "accessedAt",
        "usage"
      ],
      "properties": {
        "sourceId": {
          "type": "string",
          "pattern": "^[a-z0-9][a-z0-9._:-]{1,127}$"
        },
        "title": {
          "type": "string",
          "minLength": 1,
          "maxLength": 240
        },
        "url": {"type": "string", "format": "uri"},
        "sourceType": {
          "enum": [
            "api",
            "documentation",
            "repository",
            "schema",
            "example",
            "issue",
            "release",
            "article",
            "other"
          ]
        },
        "publisher": {
          "type": "string",
          "minLength": 1,
          "maxLength": 160
        },
        "accessedAt": {"type": "string", "format": "date-time"},
        "retrievedAt": {"type": "string", "format": "date-time"},
        "license": {
          "type": "string",
          "minLength": 1,
          "maxLength": 120
        },
        "version": {
          "type": "string",
          "minLength": 1,
          "maxLength": 120
        },
        "contentDigest": {
          "type": "object",
          "additionalProperties": false,
          "required": ["algorithm", "value"],
          "properties": {
            "algorithm": {"enum": ["sha256"]},
            "value": {"type": "string", "pattern": "^[a-f0-9]{64}$"}
          }
        },
        "usage": {
          "type": "object",
          "additionalProperties": false,
          "required": ["purpose", "derivedFacts"],
          "properties": {
            "purpose": {
              "enum": [
                "input",
                "validation",
                "compatibility-check",
                "citation",
                "fixture-basis",
                "schema-reference",
                "other"
              ]
            },
            "derivedFacts": {
              "type": "array",
              "maxItems": 20,
              "items": {
                "type": "string",
                "minLength": 1,
                "maxLength": 300
              }
            },
            "limitations": {
              "type": "array",
              "maxItems": 20,
              "items": {
                "type": "string",
                "minLength": 1,
                "maxLength": 300
              }
            }
          }
        }
      }
    }
  }
}
